<?xml version="1.0" encoding="UTF-8"?>

<articles xsi:noNamespaceSchemaLocation="./article.xsd" xmlns:xsi="http://www.w3.org/2001/XMLSchema-instance">
    <article cat="C1">
        <référence>P01</référence>
        <intitulé>PC PORTABLE</intitulé>
        <prixTTC>8400,00</prixTTC>
    </article>
    <article cat="C2">
        <référence>P03</référence>
        <intitulé>IMPRIMANTE </intitulé>
        <prixTTC>2400,00</prixTTC>
    </article>
    <article cat="C2">
        <référence>P02</référence>
        <intitulé>LOGICIEL ANTIVIRUS </intitulé>
        <prixTTC>1050,00</prixTTC>
    </article>
</articles>